<?xml version="1.0" encoding="UTF-8"?>
<productlist
        xmlns:xsi="http://www.w3.org/2001/XMLSchema-instance"
        xsi:noNamespaceSchemaLocation="products.xsd">
    <category name="метизы">
        <subcategory name="гвозди">
            <product>
                <manufacturer>365days</manufacturer>
                <model>Ab123</model>
                <dateofmanufacture>31-01-2019</dateofmanufacture>
                <color>green</color>
                <price>6.10</price>
                <count>24</count>
            </product>
        </subcategory>
        <subcategory name="саморезы">
            <product>
                <manufacturer>mitsubishi motors</manufacturer>
                <model>se333</model>
                <dateofmanufacture>28-02-2019</dateofmanufacture>
                <color>red</color>
                <price>99.99</price>
                <count>9000</count>
            </product>
        </subcategory>
    </category>
    <category name="электроинструмент">
        <subcategory name="перфораторы">
            <product>
                <manufacturer>bosch</manufacturer>
                <model>xx999</model>
                <dateofmanufacture>22-11-2019</dateofmanufacture>
                <color>black</color>
                <price>999.10</price>
                <count>1</count>
            </product>
        </subcategory>
    </category>
</productlist>